{
  "run_id": "20260823-093000-lixiang",
  "brand": "理想汽车",
  "category": "媒体观点供稿",
  "communication": {
    "publisher": "品牌官方",
    "audience": "行业媒体记者",
    "intent": "让记者理解停产背后的战略判断"
  },
  "delivery_contract": {
    "channel": "媒体供稿",
    "length": "1500 字左右",
    "format": "Markdown"
  },
  "fact_bounds": {
    "allowed_fact_ids": [
      "F1",
      "F2"
    ],
    "forbidden": []
  },
  "line": "主动停产不是被动收缩，而是有纯电能力支撑的战略选择",
  "material_plan": {
    "foreground": [
      "F2",
      "F1"
    ],
    "discarded": [
      "财务现金流细节"
    ]
  },
  "information_budget": "战略取舍 55%、交付结果 30%、行业语境 15%",
  "expression_bounds": [
    "不拉踩竞品",
    "不使用品牌自述口吻"
  ],
  "memories_applied": [],
  "authorized_reads": [
    "/attachments/【指引】理想汽车2026年第一季度财报.md",
    "/attachments/【新闻稿】理想汽车公布2026年第一季度财报.md"
  ],
  "style_refs": [],
  "assumptions": [],
  "ab": false
}