{
  "run_id": "20260821-093000-lixiang",
  "brand": "理想汽车",
  "category": "媒体观点供稿",
  "communication": {
    "publisher": "行业媒体署名",
    "audience": "行业媒体",
    "intent": "说明交付节奏"
  },
  "delivery_contract": {
    "channel": "媒体供稿",
    "length": "1000 字",
    "format": "Markdown"
  },
  "fact_bounds": {
    "allowed_fact_ids": [
      "F1"
    ],
    "forbidden": []
  },
  "line": "交付节奏说明产品被市场接受",
  "material_plan": {
    "foreground": [
      "F1"
    ],
    "discarded": []
  },
  "information_budget": "交付 70%、语境 30%",
  "expression_bounds": [],
  "memories_applied": [],
  "authorized_reads": [
    "05-成品参考/新闻稿/经营类/2026年3月交付.md"
  ],
  "style_refs": [
    "05-成品参考/新闻稿/经营类/2026年3月交付.md"
  ],
  "assumptions": [],
  "ab": false
}