{
  "run_id": "20260822-090000-lixiang",
  "brand": "理想汽车",
  "category": "新闻稿",
  "communication": {"publisher": "品牌官方", "audience": "行业媒体", "intent": "理解交付节奏"},
  "delivery_contract": {"channel": "官方新闻中心", "length": "800 字"},
  "fact_bounds": {"allowed_fact_ids": ["F1"], "forbidden": []},
  "line": "交付节奏证明产品被市场接受",
  "material_plan": {"foreground": ["F1"], "background": [], "discarded": []},
  "information_budget": "交付数据 60%、背景 40%",
  "expression_bounds": [],
  "authorized_reads": ["05-成品参考/新闻稿/经营类/2026年3月交付.md"],
  "assumptions": [],
  "ab": false
}
