{
  "run_id": "20260823-110000-lixiang",
  "brand": "理想汽车",
  "category": "媒体观点供稿",
  "communication": {
    "publisher": "行业媒体署名",
    "audience": "行业媒体记者",
    "intent": "让对方相信平台已过量产门槛"
  },
  "delivery_contract": {
    "channel": "媒体供稿",
    "length": "1200 字左右",
    "format": "Markdown"
  },
  "fact_bounds": {
    "allowed_fact_ids": [
      "F1",
      "F2"
    ],
    "forbidden": [
      "良品率具体数值"
    ]
  },
  "line": "增程平台已经跨过量产门槛，交付数据只是它的结果",
  "material_plan": {
    "foreground": [
      "F2",
      "F1"
    ],
    "discarded": [
      "F0"
    ]
  },
  "information_budget": "平台与产线 55%、交付结果 30%、行业语境 15%",
  "expression_bounds": [
    "不得使用品牌自述口吻",
    "不得拉踩竞品",
    "不披露良品率数值"
  ],
  "memories_applied": [],
  "authorized_reads": [
    "05-成品参考/新闻稿/经营类/2026年3月交付.md"
  ],
  "style_refs": [
    "05-成品参考/新闻稿/经营类/2026年3月交付.md"
  ],
  "assumptions": [
    "记者更关心可持续性而非单季数字"
  ],
  "ab": false
}